{
  "$schema": "https://json-schema.org/draft/2020-12/schema",
  "$id": "https://sysadmindoc.github.io/network-security-auditor/schemas/exports/findings.schema.json",
  "title": "Network Security Auditor structured findings export",
  "type": "object",
  "required": ["tool", "tool_version", "schema_version", "timestamp", "client", "auditor", "scan_profile", "environment", "score", "coverage", "findings", "compliance_frameworks", "exceptions"],
  "properties": {
    "tool": { "type": "string" },
    "tool_version": { "type": "string" },
    "schema_version": { "type": "string" },
    "timestamp": { "type": "string" },
    "client": { "type": "string" },
    "auditor": { "type": "string" },
    "scan_profile": { "type": "string" },
    "environment": {
      "type": "object",
      "required": ["computer_name", "os_caption", "os_version", "os_build", "is_server", "is_domain_joined", "domain_name", "join_type", "azure_ad_joined", "intune_managed"],
      "properties": {
        "computer_name": { "type": "string" },
        "os_caption": { "type": "string" },
        "os_version": { "type": "string" },
        "os_build": { "type": "integer" },
        "is_server": { "type": "boolean" },
        "is_domain_joined": { "type": "boolean" },
        "domain_name": { "type": "string" },
        "join_type": { "type": "string" },
        "azure_ad_joined": { "type": "boolean" },
        "intune_managed": { "type": "boolean" }
      }
    },
    "score": {
      "type": "object",
      "required": ["overall", "grade", "ransomware_readiness", "ransomware_grade", "domain_maturity", "domain_maturity_grade", "sprs_score", "sprs_confidence"],
      "properties": {
        "overall": { "type": "integer" },
        "grade": { "type": "string" },
        "ransomware_readiness": { "type": "integer" },
        "ransomware_grade": { "type": "string" },
        "domain_maturity": { "type": "integer" },
        "domain_maturity_grade": { "type": "string" },
        "sprs_score": { "type": "integer" },
        "sprs_confidence": { "type": "string" }
      }
    },
    "coverage": {
      "type": "object",
      "required": ["applicable", "scored", "not_assessed", "error", "timed_out", "pct"],
      "properties": {
        "applicable": { "type": "integer" },
        "scored": { "type": "integer" },
        "not_assessed": { "type": "integer" },
        "error": { "type": "integer" },
        "timed_out": { "type": "integer" },
        "pct": { "type": "number" }
      }
    },
    "findings": {
      "type": "array",
      "items": {
        "type": "object",
        "required": ["id", "label", "category", "severity", "status", "findings", "evidence", "compliance", "duration_ms"],
        "properties": {
          "id": { "type": "string" },
          "label": { "type": "string" },
          "category": { "type": "string" },
          "severity": { "type": "string" },
          "status": { "type": "string" },
          "findings": { "type": "string" },
          "evidence": { "type": "string" },
          "compliance": { "type": "string" },
          "duration_ms": { "type": "number" }
        }
      }
    },
    "exceptions": {
      "type": "array",
      "items": {
        "type": "object",
        "required": ["check_id", "status"],
        "properties": {
          "check_id": { "type": "string" },
          "status": { "type": "string" },
          "expiration": { "type": ["string", "null"] }
        }
      }
    },
    "compliance_frameworks": {
      "type": "object",
      "additionalProperties": {
        "type": "object",
        "required": ["mapped_controls", "total_controls", "passing_controls", "met_controls", "partial_controls", "failing_controls", "not_assessed_controls", "coverage"],
        "properties": {
          "mapped_controls": { "type": "integer" },
          "total_controls": { "type": "integer" },
          "passing_controls": { "type": "integer" },
          "met_controls": { "type": "integer" },
          "partial_controls": { "type": "integer" },
          "failing_controls": { "type": "integer" },
          "not_assessed_controls": { "type": "integer" },
          "coverage": { "type": "number" }
        }
      }
    }
  }
}
